{
  "version": 1,
  "calibrated": true,
  "calibrationNote": "方法：对本机 Chatterbox 旁路用 probeText 在 speed=1.0 实测基线 WPM=180.0，再 speed=targetWpm/baselineWpm。 目标 WPM 来自 data/listening-tts/calibration.targets.json（考试大纲常见转述区间等，见各档 targetWpmSource）。 停顿来自本仓库听力稿结构约定（非北京真题静音实测）。 未见北京市考试院公开「听力录音」官方 WPM；若要对齐具体北京真题听感，请用授权音频复测后改 targets 并重跑 calibrate。 标定时间：2026-07-21T23:43:48.931Z",
  "endpoint": {
    "baseUrl": "http://127.0.0.1:7778/v1",
    "apiKey": "",
    "model": "chatterbox",
    "responseFormat": "wav",
    "extraBody": {}
  },
  "slots": {
    "narrator": {
      "voice": "narrator",
      "referenceWav": "data/listening-tts/samples/narrator.wav",
      "label": "旁白（题号/复听提示）"
    },
    "dialogue": [
      {
        "voice": "dialogue-a",
        "referenceWav": "data/listening-tts/samples/dialogue-a.wav",
        "label": "对话角色槽 0（按材料 Name: 出现顺序映射）"
      },
      {
        "voice": "dialogue-b",
        "referenceWav": "data/listening-tts/samples/dialogue-b.wav",
        "label": "对话角色槽 1"
      }
    ]
  },
  "gradeBands": [
    {
      "id": "primary_upper",
      "label": "小学高段",
      "matchSubjectSubstrings": [
        "小学",
        "五年级",
        "六年级"
      ],
      "speed": 0.667,
      "cueGapSec": 1,
      "turnGapSec": 0.4
    },
    {
      "id": "junior",
      "label": "初中/中考向",
      "matchSubjectSubstrings": [
        "初一",
        "初二",
        "初三",
        "初中",
        "中考"
      ],
      "speed": 0.667,
      "cueGapSec": 1,
      "turnGapSec": 0.4
    },
    {
      "id": "senior",
      "label": "高中/衔接向",
      "matchSubjectSubstrings": [
        "高一",
        "高二",
        "高三",
        "高中",
        "初升高"
      ],
      "speed": 0.722,
      "cueGapSec": 1,
      "turnGapSec": 0.4
    }
  ]
}
